{
  "format": "SCOPE-PREVIEW-EVIDENCE/1",
  "createdAt": "2026-09-14T03:37:33.267Z",
  "environment": {
    "platform": "darwin",
    "release": "25.6.0",
    "architecture": "arm64",
    "cpu": "Apple M5 Pro",
    "logicalCpuCount": 15,
    "totalMemoryBytes": 25769803776,
    "node": "v24.21.0"
  },
  "recordingRoot": "recordings/issue-35-2026-09-14T03-37-28.362Z",
  "states": [
    {
      "label": "recording",
      "lifecycle": "recording",
      "availability": "available",
      "channels": [3, 1],
      "bucketFrames": 7,
      "capacity": 256,
      "persistedFrames": 197,
      "physicalBytesAtRead": 4824,
      "originalFrameWindow": { "start": 0, "end": 197 },
      "unavailablePersistedFrameRange": null,
      "physicalGapCount": 0,
      "visibleGapCount": 0,
      "buckets": [
        {
          "start": 0,
          "end": 7,
          "persistedMembers": 7,
          "minimum": [0.0911683663725853, 0.4527810513973236],
          "maximum": [0.24371437728405, 0.45597633719444275]
        },
        {
          "start": 7,
          "end": 14,
          "persistedMembers": 7,
          "minimum": [0.26913872361183167, 0.47224852442741394],
          "maximum": [0.42168471217155457, 0.5890532732009888]
        },
        {
          "start": 14,
          "end": 21,
          "persistedMembers": 7,
          "minimum": [0.43100640177726746, 0.6085206866264343],
          "maximum": [0.4341360926628113, 0.7253254652023315]
        },
        {
          "start": 21,
          "end": 28,
          "persistedMembers": 7,
          "minimum": [0.4273551404476166, 0.7447928786277771],
          "maximum": [0.430484801530838, 0.8615976572036743]
        },
        {
          "start": 28,
          "end": 35,
          "persistedMembers": 7,
          "minimum": [0.4247470796108246, 0.842130184173584],
          "maximum": [0.47559574246406555, 0.9200000166893005]
        },
        {
          "start": 35,
          "end": 42,
          "persistedMembers": 7,
          "minimum": [0.501020073890686, 0.7058579921722412],
          "maximum": [0.6535661220550537, 0.8226627111434937]
        },
        {
          "start": 42,
          "end": 49,
          "persistedMembers": 7,
          "minimum": [0.6789904236793518, 0.5695858001708984],
          "maximum": [0.8315364122390747, 0.6863905191421509]
        },
        {
          "start": 49,
          "end": 56,
          "persistedMembers": 7,
          "minimum": [0.8304932117462158, 0.4527810513973236],
          "maximum": [0.8948364853858948, 0.5501183271408081]
        },
        {
          "start": 56,
          "end": 63,
          "persistedMembers": 7,
          "minimum": [0.65252286195755, 0.45384615659713745],
          "maximum": [0.8050689101219177, 0.4570414125919342]
        },
        {
          "start": 63,
          "end": 70,
          "persistedMembers": 7,
          "minimum": [0.47455254197120667, 0.45757395029067993],
          "maximum": [0.627098560333252, 0.4607692360877991]
        },
        {
          "start": 70,
          "end": 77,
          "persistedMembers": 7,
          "minimum": [0.4750741422176361, 0.4613017737865448],
          "maximum": [0.47820380330085754, 0.46449702978134155]
        },
        {
          "start": 77,
          "end": 84,
          "persistedMembers": 7,
          "minimum": [0.478725403547287, 0.3682248592376709],
          "maximum": [0.4818550944328308, 0.4655621349811554]
        },
        {
          "start": 84,
          "end": 91,
          "persistedMembers": 7,
          "minimum": [0.4206415116786957, 0.23195266723632812],
          "maximum": [0.48394152522087097, 0.34875738620758057]
        },
        {
          "start": 91,
          "end": 98,
          "persistedMembers": 7,
          "minimum": [0.2426711469888687, 0.09568047523498535],
          "maximum": [0.3952171504497528, 0.212485209107399]
        },
        {
          "start": 98,
          "end": 105,
          "persistedMembers": 7,
          "minimum": [0.06470081210136414, -0.0016568046994507313],
          "maximum": [0.21724681556224823, 0.07621301710605621]
        },
        {
          "start": 105,
          "end": 112,
          "persistedMembers": 7,
          "minimum": [0.013852139934897423, -0.00005917159796808846],
          "maximum": [0.039276473224163055, 0.0031360946595668793]
        },
        {
          "start": 112,
          "end": 119,
          "persistedMembers": 7,
          "minimum": [0.016981806606054306, 0.0036686391104012728],
          "maximum": [0.02011147327721119, 0.006863905116915703]
        },
        {
          "start": 119,
          "end": 126,
          "persistedMembers": 7,
          "minimum": [0.010789778083562851, 0.00739644980058074],
          "maximum": [0.023241139948368073, 0.010591715574264526]
        },
        {
          "start": 126,
          "end": 133,
          "persistedMembers": 7,
          "minimum": [-0.16718056797981262, -0.10568047314882278],
          "maximum": [-0.014634557068347931, 0.01112426072359085]
        },
        {
          "start": 133,
          "end": 140,
          "persistedMembers": 7,
          "minimum": [-0.3451509177684784, -0.24195265769958496],
          "maximum": [-0.1926048994064331, -0.12514792382717133]
        },
        {
          "start": 140,
          "end": 147,
          "persistedMembers": 7,
          "minimum": [-0.4468482434749603, -0.37822484970092773],
          "maximum": [-0.3705752491950989, -0.2614201307296753]
        },
        {
          "start": 147,
          "end": 154,
          "persistedMembers": 7,
          "minimum": [-0.44476181268692017, -0.4560946822166443],
          "maximum": [-0.44163215160369873, -0.3976922929286957]
        },
        {
          "start": 154,
          "end": 161,
          "persistedMembers": 7,
          "minimum": [-0.4411105215549469, -0.453964501619339],
          "maximum": [-0.43798086047172546, -0.45076924562454224]
        },
        {
          "start": 161,
          "end": 168,
          "persistedMembers": 7,
          "minimum": [-0.5770322680473328, -0.4502366781234741],
          "maximum": [-0.437459260225296, -0.44704142212867737]
        },
        {
          "start": 168,
          "end": 175,
          "persistedMembers": 7,
          "minimum": [-0.7550026178359985, -0.44650888442993164],
          "maximum": [-0.6024566292762756, -0.4433135986328125]
        },
        {
          "start": 175,
          "end": 182,
          "persistedMembers": 7,
          "minimum": [-0.9075486660003662, -0.5795857906341553],
          "maximum": [-0.7804269790649414, -0.46278107166290283]
        },
        {
          "start": 182,
          "end": 189,
          "persistedMembers": 7,
          "minimum": [-0.8816027045249939, -0.715857982635498],
          "maximum": [-0.7290566563606262, -0.5990532636642456]
        },
        {
          "start": 189,
          "end": 196,
          "persistedMembers": 7,
          "minimum": [-0.7036323547363281, -0.8521301746368408],
          "maximum": [-0.5510863661766052, -0.7353254556655884]
        },
        {
          "start": 196,
          "end": 197,
          "persistedMembers": 1,
          "minimum": [-0.5256620049476624, -0.8715976476669312],
          "maximum": [-0.5256620049476624, -0.8715976476669312]
        }
      ]
    },
    {
      "label": "stopping",
      "lifecycle": "stopping",
      "availability": "available",
      "channels": [3, 1],
      "bucketFrames": 7,
      "capacity": 256,
      "persistedFrames": 197,
      "physicalBytesAtRead": 4824,
      "originalFrameWindow": { "start": 0, "end": 197 },
      "unavailablePersistedFrameRange": null,
      "physicalGapCount": 0,
      "visibleGapCount": 0,
      "buckets": [
        {
          "start": 0,
          "end": 7,
          "persistedMembers": 7,
          "minimum": [0.0911683663725853, 0.4527810513973236],
          "maximum": [0.24371437728405, 0.45597633719444275]
        },
        {
          "start": 7,
          "end": 14,
          "persistedMembers": 7,
          "minimum": [0.26913872361183167, 0.47224852442741394],
          "maximum": [0.42168471217155457, 0.5890532732009888]
        },
        {
          "start": 14,
          "end": 21,
          "persistedMembers": 7,
          "minimum": [0.43100640177726746, 0.6085206866264343],
          "maximum": [0.4341360926628113, 0.7253254652023315]
        },
        {
          "start": 21,
          "end": 28,
          "persistedMembers": 7,
          "minimum": [0.4273551404476166, 0.7447928786277771],
          "maximum": [0.430484801530838, 0.8615976572036743]
        },
        {
          "start": 28,
          "end": 35,
          "persistedMembers": 7,
          "minimum": [0.4247470796108246, 0.842130184173584],
          "maximum": [0.47559574246406555, 0.9200000166893005]
        },
        {
          "start": 35,
          "end": 42,
          "persistedMembers": 7,
          "minimum": [0.501020073890686, 0.7058579921722412],
          "maximum": [0.6535661220550537, 0.8226627111434937]
        },
        {
          "start": 42,
          "end": 49,
          "persistedMembers": 7,
          "minimum": [0.6789904236793518, 0.5695858001708984],
          "maximum": [0.8315364122390747, 0.6863905191421509]
        },
        {
          "start": 49,
          "end": 56,
          "persistedMembers": 7,
          "minimum": [0.8304932117462158, 0.4527810513973236],
          "maximum": [0.8948364853858948, 0.5501183271408081]
        },
        {
          "start": 56,
          "end": 63,
          "persistedMembers": 7,
          "minimum": [0.65252286195755, 0.45384615659713745],
          "maximum": [0.8050689101219177, 0.4570414125919342]
        },
        {
          "start": 63,
          "end": 70,
          "persistedMembers": 7,
          "minimum": [0.47455254197120667, 0.45757395029067993],